[
  {
    "id": "codex",
    "displayName": "Codex",
    "projectSkillPath": ".codex/skills/vendor_imports",
    "globalSkillPath": "~/.codex/skills/vendor_imports",
    "mcpSupported": true,
    "supportsSymlink": true,
    "supportsCopy": true,
    "notes": [
      "Uses a vendor_imports skills path for managed materialization.",
      "Optional helper assets are preserved but may not be consumed directly."
    ],
    "capabilities": {
      "instructions": "native",
      "frontmatter": "preserved",
      "scripts": "ignored",
      "assets": "ignored",
      "references": "preserved",
      "helpers": "ignored"
    }
  },
  {
    "id": "claude",
    "displayName": "Claude Code",
    "projectSkillPath": ".claude/skills",
    "globalSkillPath": "~/.claude/skills",
    "mcpSupported": true,
    "supportsSymlink": true,
    "supportsCopy": true,
    "notes": [
      "Instruction content is portable; optional assets are preserved without being required."
    ],
    "capabilities": {
      "instructions": "native",
      "frontmatter": "preserved",
      "scripts": "ignored",
      "assets": "ignored",
      "references": "preserved",
      "helpers": "ignored"
    }
  },
  {
    "id": "cursor",
    "displayName": "Cursor",
    "projectSkillPath": ".cursor/skills",
    "globalSkillPath": "~/.cursor/skills",
    "mcpSupported": true,
    "supportsSymlink": true,
    "supportsCopy": true,
    "notes": [
      "Top-level vendor aliases are retained for discoverability."
    ],
    "capabilities": {
      "instructions": "native",
      "frontmatter": "preserved",
      "scripts": "ignored",
      "assets": "ignored",
      "references": "preserved",
      "helpers": "ignored"
    }
  },
  {
    "id": "copilot",
    "displayName": "GitHub Copilot",
    "projectSkillPath": ".copilot/skills",
    "globalSkillPath": "~/.copilot/skills",
    "mcpSupported": true,
    "supportsSymlink": true,
    "supportsCopy": true,
    "notes": [
      "Skill directories are preserved faithfully even when optional helpers are not consumed."
    ],
    "capabilities": {
      "instructions": "native",
      "frontmatter": "preserved",
      "scripts": "ignored",
      "assets": "ignored",
      "references": "preserved",
      "helpers": "ignored"
    }
  },
  {
    "id": "gemini",
    "displayName": "Gemini CLI",
    "projectSkillPath": ".gemini/skills",
    "globalSkillPath": "~/.gemini/skills",
    "mcpSupported": true,
    "supportsSymlink": true,
    "supportsCopy": true,
    "notes": [
      "Path-local discovery means aliases are materialized, but optional assets still remain advisory."
    ],
    "capabilities": {
      "instructions": "native",
      "frontmatter": "preserved",
      "scripts": "ignored",
      "assets": "ignored",
      "references": "preserved",
      "helpers": "ignored"
    }
  }
]
